{
  "skill": "local-seo-outreach-playbook",
  "change_type": "add_example",
  "suggested_rule": "Quando a clinica perguntar como foi encontrada, responder a origem em uma frase antes de pedir o responsavel.",
  "reason": "A pergunta de fonte apareceu como primeira objecao e a resposta direta reduz desconfianca.",
  "based_on_count": 1,
  "confidence": 0.55,
  "expected_impact": "Melhorar continuidade em leads frios sem aumentar pressao.",
  "analysis_mode": "elite_300",
  "token_efficiency_mode": "elite_300",
  "token_budget_level": "high",
  "should_use_elite_mode": true,
  "elite_mode_reason": "skill_update_suggestion_requires_human_approval",
  "estimated_token_cost_level": "very_high",
  "data_loading_strategy": "full_campaign_analysis",
  "large_context_allowed": true,
  "requires_human_approval": true
}
